"education_id","title","description","date_range","candidate_id"
2376,"University of Northern British Columbia","Bachelor of Science (B.Sc.), Computer Science","2000 – 2005",3275
2377,"University of Northern British Columbia Prince George,","Bachelor of Science, Computer Science","2000 – 2005",3275
2378,"The University of British Columbia","Computer Science","1995 – 2000",3276
2379,"The University of British Columbia","Bachelors, Computer Science","2000 – 2003",3277
2380,"UBC","Bachelor of Science (BS), Computer Science","2000 – 2003",3277
2381,"IUST",NULL,"",3277
2382,"Ohio University","Master of Business Administration (M.B.A.), Executive Leadership","2016 – 2017",3278
2383,"Dr. B. R. Ambedkar National Institute of Technology, Jalandhar","B.Tech, Computer Science","1993 – 1997",3278
2384,"Bernard M. Baruch College","Bachelor of Business Administration (BBA), Computer Systems / Management","1981 – 1984",3279
2385,"University of Massachusetts, Amherst","BS, Computer & Information Science","1982 – 1985",3280
2386,"Northeastern University","Chemical Engineering","1981 – 1982",3280
2387,"Rensselaer Polytechnic Institute","Computer Science","1980 – 1980",3280
2388,"MIT","Computer Programming","1979 – 1979",3280
2389,"Bridgewater State College","Computer Programming","1976 – 1977",3280
2390,"The University of British Columbia","B.Sc, Computer Science (w/ Minor in Business)","2000",3281
2391,"Eastern Illinois University","BS, Computer Science","1997 – 2001",3282
2392,"Georgetown University","M.A., English","1993 – 1995",3283
2393,"Boston College","B.A,, English/Philosophy","September 1988 – May 1992",3283
2394,"St. Anselm's Abbey School","High School Diploma","1982 – 1988",3283
2395,"University of Wisconsin-Madison","MS, Computer Sciences","1995 – 1997",3284
2396,"Rensselaer Polytechnic Institute","BS, Computer Science","1991 – 1995",3284
2397,"Washington University in St. Louis","BS, Computer Science","1993 – 1997",3285
2398,"Yale University","MES, Environmental Management","September 1994 – May 1996",3286
2399,"Oberlin College","BA, Sociology, Anthropology","September 1983 – May 1987",3286
2400,"Colorado State University","BS, Computer Science","2008 – 2012",3287
2401,"University of Rochester","B.S., Computer Science","1996 – 2001",3288
2402,"Rotterdam School of Management, Erasmus University","MBA, International Business","2008 – 2010",3289
2403,"University of Colorado Denver","Bachelor of Science, Mathematics (graduated with honors), Physics Minor","1993 – 1999",3289
2404,"University of California San Diego","Post Masters, Computer Sciences","1995 – 1996",3290
2405,"University of Wisconsin-Madison","Post Masters, Computer Sciences","1987 – 1989",3290
2406,"University of Wisconsin-Madison","MS, Computer Sciences","1981 – 1985",3290
2407,"University of Wisconsin-Madison","BS, Mathematics","1978 – 1981",3290
2408,"Middlebury Institute of International Studies at Monterey","Certificate of Graduation, Arabic Language","1975 – 1976",3290
2409,"Shepherd University","BS, Business Administration","",3291
2410,"The University of Texas at Austin","English","2007 – 2012",3292
2411,"Austin Community College","Associate's Degree, Computer Science","2014 – 2016",3292
2412,"Austin Community College","Accelerated Programmer Training, Web Development","2014 – 2016",3292
2413,"Poona Univ.","Master of Computer Science, Computer Software Engineering","1987 – 1994",3293
2414,"Savitribai Phule Pune University","Masters, Computer Science","1990 – 1994",3293
2415,"University of Kentucky","Bachelor of Science, Mathematics, Computer Science","1989 – 1991",3294
2416,"Goethe Institute","Certificate, German","2001 – 2001",3294
2417,"Goethe Institute","Certificate, German","2000 – 2000",3294
2418,"US Army","Certificate, Platoon Leadership Development Course","1994 – 1994",3294
2419,"US Army Signal School","Certificate, Telecommunications Terminal Devices Repair","1993 – 1993",3294
2420,"US Army Signal School","Certificate, DC Electronics","1993 – 1993",3294
2421,"US Army Signal School","Certificate, AC Electronics","1993 – 1993",3294
2422,"US Army Signal School","Certificate, Fundamentals of PC Technology","1993 – 1993",3294
2423,"Eastern Kentucky University","N/A, Pre-Electrical Engineering","1985 – 1988",3294
2424,"University of Rochester","B.A., Cognitive Science","",3295
2425,"James Madison University","Bachelor of Science (BS), Computer Science","2000 – 2003",3296
2426,"Howard Payne University","Bachelor of Science (BS), Information Technology","1999 – 2000",3296
2427,"Relevant Continuing Education Course Work, Certifications, and Awards",NULL,"",3297
2428,"State University of New York - College of Environmental Science and Forestry","BS - Summa Cum Laude, Environmental Science","",3297
2429,"Ohio University","Physics","",3297
2430,"Universidad de Belgrano","Licenciatura en Administracion de Recursos Humanos, Recursos Humanos","2012 – 2017",3298
2431,"Universidad de Ciencias Empresariales y Sociales","Licenciatura, Marketing","2001 – 2003",3299
2432,"Fundación de Altos Estudios en Ciencias Comerciales (F.A.E.C.)","Tecnico Superior , Marketing","1997 – 2000",3299
2433,"Alianza Francesa de Buenos Aires","8vo año de Traductorado e Interpretariado","",3299
2434,"Cultural Inglesa de Buenos Aires","Proficiency","",3299
2436,"Universidad Caece","Lic. en Sistemas, Information Technology","2009 – 2012",3301
2437,"Instituto Tecnologico Philips Argentina","Tecnico Electronico y Electromecanico, Electricity, Electronics, Automation,","1997 – 2002",3301
2438,"Villa Devoto School",NULL,"2006 – 2011",3302
2439,"Universidad de Buenos Aires","Licencitura, Licencatura en Administración","2012 – 2017",3302
2440,"Universidad de San Andrés","Master in Business & Technology, Gestión de Servicios Tecnológicos y Telecomuniaciones","2020 – 2021",3302
2443,"Universidad Nacional del Centro de la Provincia de Buenos Aires","Systems Analyst, Systems Engineering","2005 – 2012",3304
2444,"The Johns Hopkins University","M.S, Biotechnology","2002 – 2010",3305
2445,"University of Maryland","M.S, Computer Engineering","1989 – 1992",3305
2446,"PSG College of Technology","BE, Electrical Engineering","1985 – 1989",3305
2447,"Vikaasa School",NULL,"1981 – 1985",3305
2448,"The George Washington University","BA, Middle Eastern Studies","1991 – 1995",3306
2449,"Middlebury College","Language Program, Arabic Language","1994 – 1994",3306
2450,"The George Washington University","BS, Computer Science","1999 – 2003",3307
2451,"University of Virginia Darden School of Business","Executive Certificate, Technology Leadership","2017 – 2017",3307
2452,"Georgetown University","Certificate, Project Management","2008 – 2008",3307
2453,"State University of New York College at Buffalo","B.S.Ed","1996",3308
2454,"Wheaton College (MA)","BA, Hispanic and Latin American Languages, Literatures, and Linguistics, General","",3309
2455,"George Mason University","B.S., Electrical Engineering (Cum Laude)","",3310
2456,"University of Missouri-Columbia","BS, Computer Science","1999 – 2003",3311
2457,"South Dakota State University","Bachelor of Science (BS), Electrical and Electronics Engineering","1989 – 1991",3312
2458,"Dordt College","Electrical and Electronics Engineering","1987 – 1989",3312
2459,"Bharathiar University","BS, Computer Science","1994 – 1997",3313
2460,"Arizona State University","Bachelor of Science (BS), Computer Science","2008 – 2012",3314
2461,"Centennial High School","High School Diploma","",3314
2462,"University of California, Los Angeles - The Anderson School of Management","MBA","2004 – 2007",3316
2463,"University of California San Diego","Bachelor of Science - BS, Molecular Biology","",3316
2464,"George Mason University - School of Management","MS In Technology Management, Management","2011 – 2012",3318
2465,"Dharmsinh Desai University","Bachelor, Computer Engineering","1994 – 1997",3318
2466,"AVPTI","Diploma, Computer Engineering","1991 – 1994",3318
3026,"Iowa State University","MBA / MSIS, IT","2002 – 2005",3599
2467,"Eastern Michigan University","Bachelor of Business Administration, Computer Information Systems","1994 – 1999",3319
2468,"Virginia Polytechnic Institute and State University","Bachelor of Science (B.S.), Computer Engineering","2001 – 2006",3320
2471,"Hack Reactor","Full Stack Web Developer, Computer Software Engineering","2016 – 2016",3323
2473,"Bullock Creek High School","High School Diploma","2006 – 2010",3323
2474,"The George Washington University","Masters Degree, Information Technology","1999 – 2000",3324
2475,"The George Washington University","Bachelors of Business Administration, Information Technology","1995 – 1999",3324
2476,"University of Manitoba","BSc. CSc., Computer Science","1983 – 1988",3325
2477,"Rutgers University","BS, Computer Science, Mathematics","1998 – 2001",3327
2478,"University of Maryland - Robert H. Smith School of Business","Master of Business Administration (MBA)","2004 – 2006",3328
2479,"Frostburg State University","Bachelor of Science (BS), Physics, Math","1991 – 1996",3328
2480,"Virginia Commonwealth University","Bachelor of Science (B.S.)","2003",3329
2481,"Santa Clara University","MBA, Business Administration and Management, General","",3330
2482,"UC Santa Barbara","BS, Computer Science","",3330
2483,"HBX | Harvard Business School","Other; ""Disruptive Strategy with Clayton Christensen""","2017",3330
2484,"University of Colorado Boulder","BS, Management Information Systems","",3331
2485,"Stevens Institute of Technology","MS, Telecommunication Management","1994 – 2006",3332
2486,"Stevens Institute of Technology","BE, Electrical Engineering","1988 – 1993",3332
2487,"Georgetown University McDonough School of Business","Certificate, International Business Management","1997 – 1998",3332
2488,"Harvard Business School","Certificate, Leading Product Development","1999 – 1999",3332
2489,"Duke University","Excel to MySQL: Analytic Techniques for Business Specialization","2015 – 2016",3332
2490,"F. G. Sir Syed College, The Mall, Rawalpindi","F.SC, Pre-Engineering","1986 – 1988",3332
2491,"Pakistan Airforce Model School, Nur Khan Airbase, Rawalpindi","Secondary School Degree, Pre-Engineering","1983 – 1986",3332
2492,"George Mason University - School of Management",NULL,"2004 – 2009",3333
2493,"Tennessee Technological University",NULL,"",3333
2494,"Devry University","Bachelor of Computer Information Systems, Computer Science","1996 – 2000",3334
2495,"Rose-Hulman Institute of Technology","Bachelor of Science (B.S.), Software Engineering","2012 – 2015",3336
2496,"Brigham Young University","Bachelor, Computer Science","2000 – 2003",3337
2497,"Brigham Young University","Bachelor of Science - BS, Computer Science","2000 – 2003",3337
2498,"Old Dominion University","BS, Electrical Engineer","1994 – 1998",3338
2499,"University of North Dakota","BBA, Marketing / Minor: Computer Science","1990 – 1995",3339
2500,"University of Phoenix","MS, Computer Information Systems","1998 – 2000",3339
2501,"Virginia Tech","Engineering, Computer Engineering, Computer Science","",3340
2502,"Canadian Academy, Kobe Japan","High School","",3340
2503,"UBC Sauder School of Business","Master of Science in Commerce, Operations Research, Information Management, Statistics","1977 – 1980",3341
2504,"Data Camp","Importing & Cleaning Data with R Track, Data Science","2019 – 2019",3341
2505,"DataCamp","R Programming Track, Data Science","2019 – 2019",3341
2506,"DataCamp","Data Manipulation with R Track, Data Science","2019 – 2019",3341
2507,"DataCamp","Data Analyst with R Track Certificate, Data Science","2019 – 2019",3341
2508,"DataCamp","Machine Learning Fundamentals in R Track, Data Science","2019 – 2019",3341
2509,"DataCamp","Text Mining with R Track Certificate, Data Science","2019 – 2019",3341
2510,"New Relic University","Certified Performance Pro, Computer Engineering","2019 – 2019",3341
2511,"Datacamp","Data Scientist with R Track, Data Science","2018 – 2019",3341
2512,"Construx Software Development","Scrum and Agile Methodologies","2015 – 2015",3341
2513,"Skillpipe - Microsoft","Training, 10977 Updating Your SQL Server Skills to Microsoft® SQL Server® 2014","2015 – 2015",3341
2514,"The University of British Columbia","M.Sc.(Commerce), Operations Research, IT","1978 – 1981",3341
2515,"The University of British Columbia","Prof.Educ., Adult Education, Secondary Education","1974 – 1975",3341
2516,"The University of British Columbia","B.Sc., Mathematics, Statistics","1970 – 1974",3341
2517,"Ubyssey School of Practix Journalism","Bachelor of Journalism, Muck raking","1970 – 1973",3341
2518,"Sir Winston Churchill High School","Arts and Science Program, Science, Mathematics","1964 – 1970",3341
2519,"University of Waterloo","Special Studies, Mathematics and Computer Science","1969 – 1969",3341
2520,"Stanford","Engineering","2011",3341
2521,"DataCamp","R Programming Track, Data Science","",3341
2522,"Sir Winston Churchill High School","Arts and Sciences","",3341
2523,"Brown University","Master of Science (M.S.), Computer Science","2004 – 2006",3342
2524,"Cornell University","Bachelor of Science (B.S.), Computer Science","1994 – 1998",3342
2525,"US Army Communications School","Secure Communications","",3343
2526,"SFU","Bachelor of Computing Science, Major in Computing Science (Software Engineering Specialist) & Minor in Business Administration","",3344
2527,"UBC","Executive Development Certificate, Business Executive Education","",3344
2528,"Georgia Institute of Technology","BS, Computer Science","1993 – 1997",3345
2529,"The University of British Columbia","Bachelor of Science (B.Sc.), Computer Science","1996 – 2002",3346
2530,"The Carey Business School, Johns Hopkins University","M.S, Management Information Systems","2003 – 2005",3347
2531,"University of Virginia","BS, Engineering Science","1997 – 2001",3347
2532,"ICFAI","Diploma in Business Management, Finance","2003 – 2005",3348
2533,"National Institute of Technology Rourkela","Bachelor of Engineering","1992 – 1996",3348
2534,"South Dakota State University","BS, Psychology","1995 – 2000",3349
2539,"Universalidad argentina","Computer Engeneering","1990 – 1996",3352
2549,"Cornell University","BS, 1998","1994 – 1998",3356
2550,"Shepherd University","Bachelor of Science, Accounting","2003 – 2006",3357
2551,"DeVry University","BS in Technical Management, Technology and Business Management","2004 – 2007",3358
2552,"Southern Illinois University, Carbondale","Computer Science","2004 – 2007",3359
2553,"Fisher College","Computer Information/Management","1995 – 1999",3360
2554,"University of Massachusetts Dartmouth",NULL,"",3360
2555,"Howard University","BSEE, Electrical Engineering","1993 – 1998",3361
2556,"Indiana University Bloomington","Bachelor of Science (BS), Secondary English Education","2004 – 2009",3363
2557,"Indiana State University","BS and MA, Psychology","1974 – 1980",3364
2558,"Ball State University","Master of Science, Information and Communication Sciences","2006 – 2007",3365
2559,"Ball State University","BS, Industry and Technology, Computer Technology Option","2002 – 2006",3365
2560,"Alchemist Accelerator",NULL,"2014 – 2015",3366
2561,"Stanford University","Individual Classes, Business Strategy","2011 – 2011",3366
2562,"Capilano College","Individual Classes, Marketing","2003 – 2003",3366
2563,"Northern Arizona University","B.S.B.A, Computer Information Systems","1998 – 2001",3367
2564,"Oracle University","Oracle OCP","2001 – 2004",3367
2565,"University of Florida","Master’s Degree, Mechanical Engineering","1990 – 1992",3368
2566,"Cornell University","Financial Management","2005 – 2005",3368
2567,"Birla Institute of Technology","Bachelor’s Degree, Mechanical Engineering","1984 – 1988",3368
2568,"My Lifelong Learning",NULL,"",3368
2569,"The Johns Hopkins University","BA, Writing Seminars","1994 – 1998",3369
2570,"Cornell University","B.S., Computer Science","August 1994 – May 1998",3370
2571,"Brigham Young University","Bachelor’s Degree, Graphic Design","",3371
2572,"Brigham Young University","Bachelor's degree, Manufacturing Engineering Technology","",3371
2573,"Udacity","Predictive Analytics for Business Nanodegree, Data Modeling/Warehousing and Database Administration","2020 – 2020",3372
2574,"World Class Speaking","World Class Speaking Certified Coach, Public Speaker Coaching","2019 – 2020",3372
2575,"Georgetown University","Masters of Professional Studies, Technology Management","2012 – 2014",3372
2576,"Wentworth Institute of Technology","BS, Computer Engineering","1990 – 1992",3372
2577,"Toastmasters International","ACS, ALS, Communication and Leadership","2007",3372
2578,"Drexel University","PhD (Dissertation in progress), Educational Leadership","2005 – 2012",3373
2579,"Drexel University","PhD, Information Science","1995 – 2000",3373
2580,"University of Michigan","Doctor of Architecture, Computer applications in architecture","1983 – 1985",3373
2581,"Oklahoma State University","Master of Architecture (M.Arch.), Architectural Technology","1972 – 1974",3373
2582,"Oklahoma State University","Bachelor of Architecture (B.Arch.), Architecture","1969 – 1972",3373
2583,"Lehigh University","Duel Bachelor of Engr & Bachelor of Fine Arts, Metallurgical Engineering & Architecture","1967 – 1969",3373
2584,"UCLA","BS, Systems Engineering","",3374
2585,"University of California, Los Angeles",NULL,"",3374
2586,"Rensselaer Polytechnic Institute","Bachelor of Science (B.S.), Computer Science","1997 – 2001",3375
2587,"Taylor University","BS, Business/Computer Science","1976 – 1980",3376
2588,"W.P. Davidson",NULL,"1972 – 1976",3376
2589,"University of Le Havre","B.S, Computer Science","",3377
2590,"University of Kansas","Master's degree, Computer Engineering","1998 – 2000",3378
2591,"Andhra University","B.S, Mechanical Engineering","1993 – 1997",3378
2592,"The George Washington University Law School","JD, Law","2002 – 2006",3379
2593,"University of Rochester","BS, Mechanical Engineering. French Minor, Certificate in International Relations","1988 – 1993",3379
2594,"The George Washington University School of Business","MBA, International Business","1990 – 1992",3380
2595,"Ohio University","BBA, Management Information Systems","1984 – 1988",3380
2596,"The Johns Hopkins University","Master's Degree, Computer Science","",3381
2597,"University of Maryland College Park","Bachelor's Degree, Computer Engineering","",3381
2598,"Novosibirsk State University (NSU)","Master, Physics & Applied Mathematics","1970 – 1975",3383
2599,"Strayer University-Maryland","Bachelor of Science (BS), Information Systems/Database Management","2013",3386
2600,"The University of Texas at Austin","MBA, Strategic Marketing","2006 – 2008",3387
2601,"Cornell University","Bachelor of Science - Engineering, Operations Research and Industrial Engineering","1994 – 1998",3387
2602,"University of Virginia - Darden Graduate School of Business Administration","Master of Business Administration (M.B.A.), Business Administration and Management, General","2004 – 2006",3388
2603,"Washington and Lee University","BA, Computer Science","1992 – 1997",3388
2604,"The George Washington University","MS, Computer Science","2001",3389
2605,"Mysore University","MS, Computer Science","1989 – 1995",3390
2606,"University of Mysore","BS, Physics, Maths, Chemistry","1987 – 1989",3390
2607,"St. Mary's University","Computer Science","2002 – 2003",3391
2608,"The University of Texas at Arlington","Computer Networks","2004 – 2005",3391
2609,"St. Mary's University","Bachelor of Science (B.S.), Computer Science","1997 – 2001",3391
2610,"The Cooper Union for the Advancement of Science and Art","BSE, Computer Engineering","1991 – 1996",3392
2611,"Rose-Hulman Institute of Technology","BS, Computer Science","1995 – 1999",3393
2612,"NYU Stern School of Business","MBA, Finance, Management","2002 – 2005",3394
2613,"The University of Georgia","BS, Computer Science","1993 – 1997",3394
2614,"Trinity University","B.A., Philosophy / Biology","1983 – 1987",3395
2615,"Georgetown University","Certificate in Executive Coaching","2009 – 2009",3396
2616,"Loyola University Maryland","MBA, Finance, International Business","1997 – 2000",3396
2617,"University of Maryland","BS, Engineering","1982 – 1987",3396
2618,"Computer / Other technology specific studies.","Associates, Information Systems","",3397
2619,"University of Nebraska - Lincoln","Bachelor, Accounting and Finance","August 1991 – May 1995",3398
2620,"University of Oxford","Bachelors, International Economics","1994 – 1994",3398
2621,"Somerset Community College","Associate's Degree, Computer Software Engineering","2006 – 2009",3399
2622,"Pulaski County High School","Comprehensive High School Diploma, Basic Computer Skills","2003 – 2006",3399
2623,"Missouri Auction School","Diploma, Auctioneering","2017",3399
2624,"Florida A&M University","Computer and Information Sciences and Support Services","1989 – 1995",3400
2625,"Universidad de los Andes - Colombia","Maestría, Ingeniería de software","2014 – 2016",3401
2626,"Universidad de Los Andes","Ingeniero de Sistemas y Computación, Opción en Computación Visual","2005 – 2010",3401
2627,"Universidad Distrital Francisco José de Caldas","Systems enginner, Engineering","2000 – 2005",3402
2628,"Universidad Nacional de Colombia","Master's degree, Computer Science","2007",3402
2629,"University of California, Berkeley, Haas School of Business","Master's Degree, Financial Engineering (MFE)","2014 – 2015",3403
2630,"CFA Institute","CFA Level 3 cleared","2010 – 2013",3403
2631,"Birla Institute of Technology and Science","B.E., Computer Science","2005 – 2009",3403
2632,"Sanskriti School",NULL,"2001 – 2005",3403
2633,"University of Madras","B.S, Engineering","1993 – 1997",3404
2634,"Don Bosco, Egmore",NULL,"",3404
2635,"UDELAR","Computer Engineering","2000 – 2018",3405
2636,"Facultad de Ingeniera Uruguay",NULL,"",3405
2637,"Facultad de Ingenieria/Centro Universitario Regional Este","Tecnologo en Informatica (studying), IT","2014 – 2020",3406
2638,"Facultad de Ingenieria/Centro Universitario Regional Este","IT, ""Taller de Programacion""","2017 – 2017",3406
2639,"Instituto Bios","Programmer Php y MySQL, Programación informática","2009 – 2009",3406
2640,"University of Cambridge","First Certificate in English, Idiomas","2005 – 2005",3406
2641,"Ministério da Educação/Secretaria de Educação Superior","Proficiência em Lingua Portuguesa para Estrangeiros, Idiomas","2009 – 2010",3406
2642,"Emi Educa","Seminario Atención al Cliente, Tecnología informática/Tecnología de sistemas informáticos","2007 – 2007",3406
2643,"EI Escuela de Informatica","Usuario Básico de PC - Ambiente Windows, Computacion","2002 – 2002",3406
2644,"Universidad Tecnológica Nacional","Tecnicatura Superior en Programación, Tecnología/Técnico de software informático","2014 – 2017",3407
2645,"Instituto RA","Analista de Sistemas , Programación","2009 – 2013",3407
2646,"Universidad Empresarial 'Siglo 21'​","Certificación Internacional en Desarrollo de Software y Programación Segura, Computer and Information Systems Security/Information Assurance","2017 – 2018",3407
2647,"Universidad ORT Uruguay","Engineer, Software Engineering","2000 – 2012",3408
2648,"Liceo Nº 1 - Liceo Deptal de Maldonado",NULL,"1991 – 2000",3408
2649,"Universidad de la República","Grado en Ingeniería, Ingeniería informática","2007",3409
2653,"Universidad ORT Uruguay","Analista de Sistemas","1993 – 1996",3411
2654,"Universidad ORT Uruguay","IT Analyst, Information Technology","2016 – 2018",3412
2655,"BIOS","Web Net Programmer, Information Technology","2015 – 2016",3412
2656,"IPA","Teaching English as a Second or Foreign Language/ESL Language Instructor","2004 – 2014",3412
2657,"University of Michigan","ECPE, Foreign Languages and Literatures, General","",3412
2660,"Universidad de las Ciencias Informáticas","Engineer's degree, Computer and Information Sciences and Support Services","2008 – 2013",3414
2663,"Universidad ORT Uruguay","IT Management, Information Technology","1995 – 2003",3417
2664,"Universidad ORT Uruguay","Telecomunication Engineer, Engineering","1994 – 2002",3417
2665,"Colegio y Liceo Sagrada Familia","High School, graduate","1980 – 1992",3417
2666,"Universidad de la República","Ingeniería en Computación","2009 – 2018",3418
2667,"FCEA - Facultad de Ciencias Económicas y de Administración","Licentiate degree, Economics","2020",3418
2668,"Instituto CTC","Programming Analyst","2008 – 2010",3419
2669,"Universidad ORT Uruguay","Computer Systems Engineer's Degree with Honors","2005 – 2014",3420
2670,"Universidad ORT Uruguay","Visual Basic .Net Development, Development","2005 – 2005",3420
2671,"Universidad ORT Uruguay","Java Language, Development","2004 – 2004",3420
2672,"ANGLO","Proficiency (CPE), English","",3420
2673,"MongoDB University","M101J: MongoDB for Java Developers, Database","2015 – 2015",3420
2681,"Universidad de la República","Postgrado, Administracion de Empresas","2000 – 2000",3424
2682,"Universidad de la República","Postgrado, Investigacion Informatica PEDECIBA","1992 – 1992",3424
2683,"Universidad de la República","Grado, Ingeneria de Sistemas","1986 – 1992",3424
2684,"Universidad ORT Uruguay","Analyst in Information of Technology","2016 – 2017",3425
